<?xml version="1.0" encoding="UTF-8"?>
<project name="String" xsi:noNamespaceSchemaLocation="../test_scenario.xsd"
	xmlns:xsi="http://www.w3.org/2001/XMLSchema-instance">
	<name>TestProject Interfaces</name>
	<description>Contains interaces</description>
	<type>
		<name>sample.ClassWithInterfaces</name>
		<property>public</property>
		<property>class</property>
	</type>
	<type>
		<name>sample.SimpleInterfaceA</name>
		<property>public</property>
		<property>interface</property>
	</type>
	<type>
		<name>sample.SimpleInterfaceB</name>
		<property>public</property>
		<property>interface</property>
	</type>
	<type>
		<name>sample.AbstractClassWithInterface</name>
		<property>abstract</property>
		<property>class</property>
	</type>
</project>
