<?xml version="1.0" encoding="UTF-8"?>
<project name="String" xsi:noNamespaceSchemaLocation="../test_scenario.xsd" xmlns:xsi="http://www.w3.org/2001/XMLSchema-instance">
	<name>TestProject One Class</name>
	<description>Contains six classes, some of them are in a cycle, some not, CCD=27</description>
	<type>
		<name>sample2.ClassA</name>
		<property>public</property>
		<property>class</property>
		<depends-on>sample2.ClassB</depends-on>
		<depends-on>sample1.ClassC</depends-on>
	</type>
	<type>
		<name>sample2.ClassB</name>
		<property>public</property>
		<property>class</property>
		<depends-on>sample1.ClassD</depends-on>
	</type>
	<type>
		<name>sample1.ClassC</name>
		<property>public</property>
		<property>class</property>
		<depends-on>sample1.ClassD</depends-on>
		<depends-on>sample1.ClassE</depends-on>
	</type>
		<type>
		<name>sample1.ClassD</name>
		<property>public</property>
		<property>class</property>
		<depends-on>sample1.ClassE</depends-on>
		<depends-on>sample1.ClassF</depends-on>
	</type>
	<type>
		<name>sample1.ClassE</name>
		<property>public</property>
		<property>class</property>
		<depends-on>sample1.ClassF</depends-on>
	</type>
	<type>
		<name>sample1.ClassF</name>
		<property>public</property>
		<property>class</property>
		<depends-on>sample1.ClassC</depends-on>
	</type>
</project>
