<?xml version="1.0" encoding="UTF-8"?>
<project name="String" xsi:noNamespaceSchemaLocation="../test_scenario.xsd" xmlns:xsi="http://www.w3.org/2001/XMLSchema-instance">
	<name>TestProject One Class</name>
	<description>Contains 3 classes which are all in a cycle, CCD=n^2=9</description>
	<type>
		<name>sample1.ClassA</name>
		<property>public</property>
		<property>class</property>
		<depends-on>sample2.ClassB</depends-on>
	</type>
	<type>
		<name>sample2.ClassB</name>
		<property>public</property>
		<property>class</property>
		<depends-on>sample1.ClassC</depends-on>
	</type>
	<type>
		<name>sample1.ClassC</name>
		<property>public</property>
		<property>class</property>
		<depends-on>sample1.ClassA</depends-on>
	</type>
</project>
