<?xml version="1.0" encoding="UTF-8"?>
<project name="String" xsi:noNamespaceSchemaLocation="../test_scenario.xsd"
	xmlns:xsi="http://www.w3.org/2001/XMLSchema-instance">
	<name>TestProject Architecture Dependencies</name>
	<description>Contains multiple architecure definition with dependencies, no cycles</description>

	<!-- application layer -->
	<type>
		<name>application.core.ClassA</name>
		<property>public</property>
		<property>class</property>
		<depends-on>application.core.config.ClassC1</depends-on>
		<depends-on>services.ClassD</depends-on>
		<depends-on>services.shop.ClassE</depends-on>
		<depends-on>services.catalogue.export.ClassG</depends-on>
		<depends-on>external.sub1.ClassXYZ</depends-on>
	</type>
	<type>
		<name>application.core.startup.ClassB</name>
		<property>public</property>
		<property>class</property>
		<depends-on>services.shop.ClassE</depends-on>
	</type>
	<type>
		<name>application.core.config.ClassC1</name>
		<property>public</property>
		<property>class</property>
		<depends-on>services.catalogue.export.ClassG</depends-on>
	</type>
	<type>
		<name>application.core.config.ClassC2</name>
		<property>public</property>
		<property>class</property>
		<depends-on>services.catalogue.export.ClassG</depends-on>
	</type>
	<type>
		<name>application.core.config.ClassC2$Nested1</name>
		<property>public</property>
		<property>class</property>
		<depends-on>services.catalogue.export.ClassG</depends-on>
	</type>
	<type>
		<name>application.core.config.ClassC2$Nested2</name>
		<property>public</property>
		<property>class</property>
		<depends-on>services.catalogue.export.ClassG</depends-on>
	</type>

	<!-- service layer -->
	<type>
		<name>services.ClassD</name>
		<property>public</property>
		<property>class</property>
		<depends-on>services.catalogue.ClassF</depends-on>
	</type>
	<type>
		<name>services.shop.ClassE</name>
		<property>public</property>
		<property>class</property>
		<depends-on>services.catalogue.ClassF</depends-on>
	</type>
	<type>
		<name>services.catalogue.ClassF</name>
		<property>public</property>
		<property>class</property>
	</type>
	<type>
		<name>services.catalogue.export.ClassG</name>
		<property>public</property>
		<property>class</property>
		<depends-on>external.sub1.ClassXYZ</depends-on>
	</type>

	<!-- project external -->
	<type>
		<name>external.sub1.ClassXYZ</name>
		<property>public</property>
		<property>class</property>
	</type>
</project>
