<?xml version="1.0" encoding="UTF-8"?>
	<!-- simple cycle exist between ClassB and ClassC-->
<project name="String" xsi:noNamespaceSchemaLocation="../test_scenario.xsd" xmlns:xsi="http://www.w3.org/2001/XMLSchema-instance">
	<name>TestProject Multiple Cycles</name>
	<description>Contains multiple compilation unit cycles</description>
	<type>
		<name>sample.ClassA</name>
		<property>class</property>
		<depends-on>sample.ClassD</depends-on>
		<depends-on>sample.ClassB</depends-on>
	</type>
	<type>
		<name>sample.ClassB</name>
		<property>class</property>
		<depends-on>sample.ClassC</depends-on>
		<depends-on>sample.ClassD</depends-on>
	</type>
	<type>
		<name>sample.ClassC</name>
		<property>class</property>
		<depends-on>sample.ClassA</depends-on>
		<depends-on>sample.ClassF</depends-on>
	</type>
	<type>
		<name>sample.ClassD</name>
		<property>class</property>
		<depends-on>sample.ClassC</depends-on>
	</type>
	<type>
		<name>sample.ClassE</name>
		<property>class</property>
		<depends-on>sample.ClassF</depends-on>
	</type>
	<type>
		<name>sample.ClassF</name>
		<property>class</property>
		<depends-on>sample.ClassE</depends-on>
	</type>

</project>
