<?xml version="1.0" encoding="UTF-8"?>
<project name="String" xsi:noNamespaceSchemaLocation="../test_scenario.xsd"
	xmlns:xsi="http://www.w3.org/2001/XMLSchema-instance">
	<name>TestProject Abstract Types</name>
	<description>Contains multiple types in one comilation unit</description>
	<type>
		<name>sample.ClassWithNestedTypes</name>
		<property>public</property>
		<property>class</property>
	</type>
	<type>
		<name>sample.ClassWithNestedTypes$Nested1</name>
		<property>public</property>
		<property>class</property>
	</type>
	<type>
		<name>sample.ClassWithNestedTypes$Nested2</name>
		<property>public</property>
		<property>class</property>
		<property>abstract</property>
	</type>
	<type>
		<name>sample.ClassWithNestedTypes$INested1</name>
		<property>public</property>
		<property>interface</property>
	</type>
	<type>
	<name>sample.ClassWithNestedTypes$Nested1$NestedNested1</name>
		<property>public</property>
		<property>class</property>
	</type>
	<type>
		<name>sample.InterfaceWithNestedTypes</name>
		<property>public</property>
		<property>interface</property>
	</type>
	<type>
		<name>sample.InterfaceWithNestedTypes$Nested1</name>
		<property>public</property>
		<property>class</property>
	</type>
	<type>
		<name>sample.InterfaceWithNestedTypes$INested1</name>
		<property>public</property>
		<property>interface</property>
	</type>
	<type>
		<name>sample.InterfaceWithNestedTypes$Nested2</name>
		<property>public</property>
		<property>class</property>
		<property>abstract</property>
	</type>
</project>
