<?xml version="1.0" encoding="UTF-8"?>
<project name="String" xsi:noNamespaceSchemaLocation="../test_scenario.xsd"
	xmlns:xsi="http://www.w3.org/2001/XMLSchema-instance">
	<name>TestProject Type access</name>
	<description>Contains types with different visibility</description>
	<type>
		<name>sample.PublicClass</name>
		<property>public</property>
		<property>class</property>
	</type>
	<type>
		<name>sample.ProtectedClass</name>
		<property>protected</property>
		<property>class</property>
	</type>
	<type>
		<name>sample.PrivateClass</name>
		<property>private</property>
		<property>class</property>
	</type>
	<type>
		<name>sample.PublicFinalClass</name>
		<property>public</property>
		<property>final</property>
		<property>class</property>
	</type>
</project>
