<?xml version="1.0" encoding="UTF-8"?>
	<!-- simple cycle exist between ClassB and ClassC-->
<project name="String" xsi:noNamespaceSchemaLocation="../test_scenario.xsd"
	xmlns:xsi="http://www.w3.org/2001/XMLSchema-instance">
	<name>TestProject Simple Cycle</name>
	<description>Contains one simple cylce with two classes</description>
	<type>
		<name>sample.ClassA</name>
		<property>class</property>
		<depends-on>sample.ClassB</depends-on>
	</type>
	<type>
		<name>sample.ClassB</name>
		<property>class</property>
		<depends-on>sample.ClassC</depends-on>
	</type>
	<type>
		<name>sample.ClassC</name>
		<property>class</property>
		<depends-on>sample.ClassA</depends-on>
	</type>
</project>
